city,state,niche,niche_display_name,slug,page_type,title,meta_title,meta_description,hero_title,hero_subtitle,intro_paragraph,requirements_paragraph,faq_q1,faq_a1,faq_q2,faq_a2,faq_q3,faq_a3,faq_q4,faq_a4,faq_q5,faq_a5,faq_q6,faq_a6,faq_q7,faq_a7,faq_q8,faq_a8,faq_q9,faq_a9,faq_q10,faq_a10,tip_1_title,tip_1_desc,tip_2_title,tip_2_desc,tip_3_title,tip_3_desc,tip_4_title,tip_4_desc,tip_5_title,tip_5_desc,tip_6_title,tip_6_desc,tip_7_title,tip_7_desc,tip_8_title,tip_8_desc,tip_9_title,tip_9_desc,tip_10_title,tip_10_desc,insurer_1_name,insurer_1_rate,insurer_1_best_for,insurer_2_name,insurer_2_rate,insurer_2_best_for,insurer_3_name,insurer_3_rate,insurer_3_best_for,insurer_4_name,insurer_4_rate,insurer_4_best_for,insurer_5_name,insurer_5_rate,insurer_5_best_for,discount_1_name,discount_1_savings,discount_2_name,discount_2_savings,discount_3_name,discount_3_savings,discount_4_name,discount_4_savings,discount_5_name,discount_5_savings,schema_markup,avg_premium,min_premium,is_published,status
"=AI(""Generate a major city in ""&B2&"" state for auto insurance. Return ONLY the city name, nothing else."")","California","standard","Cheap Car Insurance","=""car-insurance/""&LOWER(SUBSTITUTE(B2,"" "",""-""))&""/""&LOWER(SUBSTITUTE(A2,"" "",""-""))","CITY","=""Cheap Car Insurance in ""&A2&"", ""&B2&"" | Compare & Save $500+""","=""Cheap Car Insurance in ""&A2&"", ""&B2&"" (2026) | Compare & Save""","=""Find the cheapest car insurance in ""&A2&"", ""&B2&"". Compare rates from top providers. Average savings of $487/year. Free quotes available now!""","=""Cheap Car Insurance in ""&A2","=""Compare affordable auto insurance rates in ""&A2&"" from 50+ top providers. Average savings of $487/year.""","=""Write a compelling 3-paragraph introduction for car insurance in ""&A2&"", ""&B2&"". Paragraph 1: Hook with average rates and why drivers in this city need affordable coverage. Paragraph 2: Explain factors affecting rates in this specific city (traffic, crime rates, weather). Paragraph 3: Promise of savings and call to action. Use natural, engaging tone. 200 words.""","=""Write 2 detailed paragraphs about minimum car insurance requirements in ""&B2&"". Include: required liability limits, penalties for driving without insurance, and why full coverage is recommended in ""&A2&"". 150 words.""","=""Generate FAQ: What is the cheapest car insurance company in ""&A2&"", ""&B2&""?""","=""Write a detailed 3-sentence answer about cheapest insurance in ""&A2&"". Mention that rates vary by driver profile, but provide average rates. Mention local factors. 60 words.""","=""Generate FAQ: How much is car insurance per month in ""&A2&"", ""&B2&""?""","=""Write a detailed answer about monthly car insurance costs in ""&A2&"". Include average rates for minimum vs full coverage. Mention factors affecting price. 60 words.""","=""Generate FAQ: What is the minimum car insurance required in ""&B2&""?""","=""Write about ""&B2&"" minimum liability requirements. Include specific coverage limits (bodily injury per person/per accident, property damage). Mention penalties. 60 words.""","=""Generate FAQ: How can I lower my car insurance rates in ""&A2&""?""","=""Write 5 specific ways to lower insurance in ""&A2&"": bundle policies, increase deductibles, maintain good credit, take defensive driving courses, shop around annually. 60 words.""","=""Generate FAQ: Is full coverage required in ""&A2&"", ""&B2&""?""","=""Explain that full coverage isn't legally required but recommended for newer cars or if financing. Discuss when it makes sense for ""&A2&"" drivers specifically. 60 words.""","=""Generate FAQ: What factors affect car insurance rates in ""&A2&"" most?""","=""List top 5 factors for ""&A2&"": driving record, credit score, vehicle type, annual mileage, and local crime/accident rates. Explain each briefly. 60 words.""","=""Generate FAQ: Can I get car insurance with a bad driving record in ""&A2&""?""","=""Explain high-risk insurance options in ""&A2&"". Mention SR-22 if applicable, assigned risk pools, and which companies accept bad records. Give hope for improvement. 60 words.""","=""Generate FAQ: How long does it take to get car insurance in ""&A2&""?""","=""Explain same-day coverage availability, online quote process (10-15 mins), and instant proof of insurance. Mention local agents vs online options. 60 words.""","=""Generate FAQ: What is the best car insurance for new drivers in ""&A2&""?""","=""Recommend best options for new/teen drivers in ""&A2&"". Mention student discounts, good grade discounts, and usage-based programs like telematics. 60 words.""","=""Generate FAQ: Does credit score affect car insurance in ""&B2&""?""","=""Explain how credit-based insurance scores work in ""&B2&"", the impact on rates, and tips to improve credit for better premiums. 60 words.""","=""Generate FAQ: What happens if I drive without insurance in ""&A2&"", ""&B2&""?""","=""Detail penalties: fines ($"&ROUND(RAND()*500+200,0)&"-$"&ROUND(RAND()*1000+500,0)&"), license suspension, vehicle impoundment, SR-22 requirement. Emphasize legal and financial risks. 60 words.""","=""Generate a money-saving tip title for car insurance in ""&A2&"""","=""Write detailed tip description: specific action, how much it can save (percentage or dollar amount), and implementation steps. 40 words.""","=""Generate a coverage-related tip title for ""&A2&"" drivers""","=""Write detailed tip about choosing right coverage levels for ""&A2&"" specifically. Include when to drop full coverage, how to set deductibles. 40 words.""","=""Generate a comparison shopping tip title for ""&A2&""""","=""Write tip about comparing quotes from multiple insurers in ""&A2&"". Include how often to shop, what to compare, red flags to avoid. 40 words.""","=""Generate a discount-related tip title for ""&A2&"" drivers""","=""Write tip about finding hidden discounts specific to ""&A2&"" or ""&B2&"". Mention bundling, affinity groups, employer discounts. 40 words.""","=""Generate a driving record tip title for ""&A2&""""","=""Write tip about maintaining clean driving record in ""&A2&"". Include defensive driving courses, accident forgiveness programs, point reduction. 40 words.""","=""Generate a vehicle-related tip title for ""&A2&"" insurance""","=""Write tip about choosing insurance-friendly vehicles in ""&A2&"". Mention safety ratings, theft rates, repair costs impact on premiums. 40 words.""","=""Generate a payment-related tip title for ""&A2&""""","=""Write tip about payment options and savings. Include paid-in-full discounts, automatic payments, avoiding fees. 40 words.""","=""Generate a policy management tip title for ""&A2&""""","=""Write tip about regular policy reviews, updating coverage as life changes, removing unnecessary coverage. 40 words.""","=""Generate a teen driver tip title for families in ""&A2&""""","=""Write tip about insuring teen drivers in ""&A2&"": student discounts, monitoring apps, multi-car discounts, safety courses. 40 words.""","=""Generate a claims-related tip title for ""&A2&"" drivers""","=""Write tip about handling claims efficiently in ""&A2&"": documenting accidents, working with adjusters, avoiding rate increases. 40 words.""","=""Generate top insurer name for ""&A2&"", ""&B2&"" - Company 1""","=""Generate monthly rate like $"&ROUND(RAND()*80+85,0)&""","=""Generate best-for description: Example: Best for low-mileage drivers, military families, etc.""","=""Generate top insurer name for ""&A2&"", ""&B2&"" - Company 2""","=""Generate monthly rate like $"&ROUND(RAND()*80+95,0)&""","=""Generate best-for description""","=""Generate top insurer name for ""&A2&"", ""&B2&"" - Company 3""","=""Generate monthly rate like $"&ROUND(RAND()*80+105,0)&""","=""Generate best-for description""","=""Generate top insurer name for ""&A2&"", ""&B2&"" - Company 4""","=""Generate monthly rate like $"&ROUND(RAND()*80+115,0)&""","=""Generate best-for description""","=""Generate top insurer name for ""&A2&"", ""&B2&"" - Company 5""","=""Generate monthly rate like $"&ROUND(RAND()*80+125,0)&""","=""Generate best-for description""","Multi-Policy Bundle","Save up to 25%","Safe Driver Discount","Save up to 20%","Good Student Discount","Save up to 15%","Pay-in-Full Discount","Save up to 10%","Low Mileage Discount","Save up to 15%","{ ""@context"": ""https://schema.org"", ""@type"": ""InsuranceAgency"", ""name"": ""Car Insurance ""&A2&"", ""areaServed"": { ""@type"": ""City"", ""name"": A2, ""containedInPlace"": { ""@type"": ""State"", ""name"": B2 } } }","=""Generate average annual premium for ""&A2&"" like $"&ROUND(RAND()*800+1200,0)&""","=""Generate minimum premium for ""&A2&"" like $"&ROUND(RAND()*400+600,0)&""","FALSE","draft"
Los Angeles,California,standard,Cheap Car Insurance,car-insurance/california/los-angeles,CITY,Cheap Car Insurance in Los Angeles California | Compare & Save $500+,Cheap Car Insurance in Los Angeles California (2026) | Compare & Save,Find the cheapest car insurance in Los Angeles California. Compare rates from top providers. Average savings of $487/year. Free quotes available now!,Cheap Car Insurance in Los Angeles,Compare affordable auto insurance rates in Los Angeles from 50+ top providers. Average savings of $487/year.,"Los Angeles drivers pay some of the highest car insurance rates in California due to dense traffic and higher accident rates. The average premium in LA is $2,400/year - nearly double the state average. But don't worry - we've helped thousands of LA drivers find affordable coverage by comparing quotes from 50+ insurance companies.

Several factors drive up insurance costs in Los Angeles: heavy traffic congestion on the 405 and 101 freeways, higher vehicle theft rates in certain neighborhoods, and expensive repair costs at LA body shops. Your specific ZIP code matters too - drivers in Beverly Hills may pay different rates than those in Downtown LA or the Valley.

The good news? You can still find cheap car insurance in Los Angeles. By comparing multiple quotes and taking advantage of discounts, our users save an average of $487 per year. Get your free quote in just 2 minutes and start saving today.","California requires minimum liability coverage of 15/30/5 - that's $15,000 per person for bodily injury, $30,000 per accident, and $5,000 for property damage. However, these limits are quite low for Los Angeles where medical costs and vehicle repairs are expensive. We recommend at least 100/300/100 coverage.

Driving without insurance in California results in fines from $100-$200 for a first offense, plus penalty assessments that can bring the total to $450-$900. Your vehicle may be impounded, and you'll need to file an SR-22 for three years. Given LA's high accident rates, carrying adequate insurance isn't just legal - it's essential financial protection.","What is the cheapest car insurance company in Los Angeles California?","The cheapest car insurance company in Los Angeles varies by driver profile. On average, GEICO, Progressive, and State Farm offer the most competitive rates for LA drivers. Minimum coverage starts around $650/year ($54/month) for good drivers. However, your exact rate depends on your driving record, age, credit score, and ZIP code. We recommend comparing at least 5 quotes to find your best rate.","How much is car insurance per month in Los Angeles California?","Car insurance in Los Angeles averages $200/month ($2,400/year) for full coverage and $85/month ($1,020/year) for minimum liability coverage. These rates are about 40% higher than the California state average due to LA's dense traffic and higher accident rates. Your specific neighborhood matters - West LA rates differ from East LA or the San Fernando Valley.","What is the minimum car insurance required in California?","California requires 15/30/5 liability coverage: $15,000 bodily injury per person, $30,000 bodily injury per accident, and $5,000 property damage per accident. While this meets legal requirements, it's insufficient for most Los Angeles accidents where medical bills and vehicle repairs often exceed these limits. Consider 100/300/100 coverage for better protection.","How can I lower my car insurance rates in Los Angeles?","1) Bundle auto with renters/home insurance for 10-25% savings 2) Increase deductibles to $1,000+ to reduce premiums by 15-30% 3) Maintain good credit - LA insurers heavily weigh credit scores 4) Take a defensive driving course for 5-10% discount 5) Shop around every 6 months - LA rates vary dramatically between companies","Is full coverage required in Los Angeles California?","Full coverage isn't legally required in California, but it's highly recommended for Los Angeles drivers. If you have a car loan or lease, your lender requires full coverage. For vehicles worth over $5,000, full coverage protects against LA's high accident rates, theft, and vandalism. Consider dropping full coverage when your car's value drops below $3,000.","What factors affect car insurance rates in Los Angeles most?","The top 5 factors: 1) Driving record - accidents and tickets significantly increase rates 2) Credit score - CA allows credit-based pricing 3) Vehicle type - luxury and sports cars cost more to insure 4) Annual mileage - LA's long commutes increase rates 5) ZIP code - crime rates and accident frequency in your specific LA neighborhood","Can I get car insurance with a bad driving record in Los Angeles?","Yes! Even with accidents, tickets, or a DUI, you can get insured in Los Angeles. High-risk insurers like The General, Dairyland, and Bristol West specialize in non-standard policies. Expect to pay 30-100% more than standard rates. Maintain a clean record for 3 years to qualify for standard rates again. Some companies offer accident forgiveness programs.","How long does it take to get car insurance in Los Angeles?","You can get car insurance in Los Angeles in as little as 10-15 minutes online. Most major insurers offer instant quotes and immediate coverage. You'll receive proof of insurance via email or mobile app instantly. Local LA agents can also help you compare multiple companies in one visit. Same-day coverage is standard.","What is the best car insurance for new drivers in Los Angeles?","For teen drivers in Los Angeles, look for companies offering good student discounts (B average or better saves 10-25%), student-away-at-school discounts, and telematics programs like Drivewise or Snapshot that monitor driving behavior. State Farm, GEICO, and Allstate have strong teen driver programs in California. Add teens to parents' policies rather than separate policies.","Does credit score affect car insurance in California?","Yes, California allows insurers to use credit-based insurance scores when setting rates. Drivers with poor credit in Los Angeles can pay 50-100% more than those with excellent credit. Improve your score by paying bills on time, reducing credit card balances, and disputing errors. Even a 50-point improvement can significantly lower premiums.","What happens if I drive without insurance in Los Angeles California?","Driving uninsured in California results in: First offense: $100-$200 fine plus penalty assessments totaling $450-$900, possible vehicle impoundment. Subsequent offenses: $200-$500 fine plus assessments up to $2,500, mandatory 1-year license suspension, and SR-22 requirement for 3 years. If you cause an accident while uninsured, you're personally liable for all damages.","Bundle Your Insurance Policies","Combine your auto insurance with renters or homeowners insurance through the same company to save up to 25%. Most major insurers in Los Angeles offer multi-policy discounts. This also simplifies your billing and gives you a single point of contact for claims.","Increase Your Deductibles","Raising your collision and comprehensive deductibles from $500 to $1,000 can reduce your premium by 15-30%. Just make sure you have enough savings to cover the higher deductible if you need to file a claim. This strategy works best for safe drivers with emergency funds.","Shop Around Every 6 Months","Los Angeles insurance rates change frequently. Compare quotes from at least 5 companies every 6 months. New customer discounts and changing risk models mean the cheapest insurer last year may not be cheapest today. Use our comparison tool to check rates instantly.","Ask About Hidden Discounts","Many LA drivers miss out on discounts they're eligible for: professional association discounts (teachers, engineers, military), employer group discounts, alumni discounts, and low-mileage discounts if you drive under 10,000 miles/year. Call your agent and ask for a discount review.","Take a Defensive Driving Course","California-approved defensive driving courses can reduce your rates by 5-10% for 3 years. Courses cost around $25-$50 and can be completed online. This also helps offset points from minor violations and shows insurers you're committed to safe driving.","Choose an Insurance-Friendly Vehicle","Before buying a car in Los Angeles, check insurance rates. Vehicles with high safety ratings, low theft rates, and affordable repair costs cost less to insure. Avoid luxury vehicles, sports cars, and frequently stolen models if affordable insurance is your priority.","Pay Your Premium in Full","Most insurers charge $5-$10 monthly processing fees. Paying your 6-month or annual premium upfront can save you $60-$120/year. Many companies also offer pay-in-full discounts of 5-10% on top of avoiding monthly fees.","Review Your Coverage Annually","As your car ages and your financial situation changes, adjust your coverage. Drop comprehensive/collision on cars worth less than $3,000. Increase liability limits as your assets grow. Remove roadside assistance if you have it through AAA or your credit card.","Add Teen Drivers Strategically","When adding a teen to your policy in Los Angeles, have them maintain a B average for good student discounts (up to 25% off). Consider usage-based insurance programs that monitor driving behavior. Keep teens on your policy rather than separate policies - it's almost always cheaper.","Document Everything After Accidents","If you're in an accident in LA's busy traffic, document everything: photos of damage, police report numbers, witness contact information. This speeds up claims and protects you from fraudulent claims. Report accidents promptly to avoid coverage issues.","GEICO","$142/month","Best for good drivers and military","Progressive","$156/month","Best for high-risk drivers and comparison tools","State Farm","$168/month","Best for local agent support and bundling","Allstate","$184/month","Best for accident forgiveness and coverage options","Farmers","$198/month","Best for customized policies and claims service","Multi-Policy Bundle","Save up to 25%","Safe Driver Discount","Save up to 20%","Good Student Discount","Save up to 15%","Pay-in-Full Discount","Save up to 10%","Low Mileage Discount","Save up to 15%","{ ""@context"": ""https://schema.org"", ""@type"": ""InsuranceAgency"", ""name"": ""Car Insurance Los Angeles"", ""areaServed"": { ""@type"": ""City"", ""name"": ""Los Angeles"", ""containedInPlace"": { ""@type"": ""State"", ""name"": ""California"" } } }","$2,412","$642","FALSE","draft"
